### ISSUE TITLE
finagle-example ThriftClient don't send request to the ThriftServer on the same host

### ISSUE THREAD

**Issue by imatespl** [twitter/finagle#253]
I run ThriftClient in sbt  <./sbt "project finagle-example" "run-main com.twitter.finagle.example.thrift.ThriftClient"> to call the ThriftServer on the same host.The Client don't send request to the server, just make the connection and then close it,tcpdump look like this:
tcpdump -i lo -n
tcpdump: verbose output suppressed, use -v or -vv for full protocol decode
listening on lo, link-type EN10MB (Ethernet), capture size 65535 bytes
22:37:03.064179 IP 127.0.0.1.44177 > 127.0.0.1.8080: Flags [S], seq 346417873, win 43690, options [mss 65495,sackOK,TS val 2758357 ecr 0,nop,wscale 7], length 0
22:37:03.064197 IP 127.0.0.1.8080 > 127.0.0.1.44177: Flags [S.], seq 2933480129, ack 346417874, win 43690, options [mss 65495,sackOK,TS val 2758358 ecr 2758357,nop,wscale 7], length 0
22:37:03.064211 IP 127.0.0.1.44177 > 127.0.0.1.8080: Flags [.], ack 1, win 342, options [nop,nop,TS val 2758358 ecr 2758358], length 0
22:37:03.472162 IP 127.0.0.1.44177 > 127.0.0.1.8080: Flags [F.], seq 1, ack 1, win 342, options [nop,nop,TS val 2758459 ecr 2758358], length 0
22:37:03.472277 IP 127.0.0.1.8080 > 127.0.0.1.44177: Flags [.], ack 2, win 342, options [nop,nop,TS val 2758460 ecr 2758459], length 0
22:37:03.472486 IP 127.0.0.1.8080 > 127.0.0.1.44177: Flags [F.], seq 1, ack 2, win 342, options [nop,nop,TS val 2758460 ecr 2758459], length 0
22:37:03.472567 IP 127.0.0.1.44177 > 127.0.0.1.8080: Flags [.], ack 2, win 342, options [nop,nop,TS val 2758460 ecr 2758460], length 0

But when I run the ThriftClient in my windows 7 in eclipse, it can send the request. it there any help?
When I add Await.ready(client.hi) to the ThriftClient source, it can send the request in any scene，but
it make two connection to the ThriftServer!
